{"schemaVersion":1,"registryVersion":1,"status":"planningSeed","generatedAt":null,"sourceCommit":null,"states":[{"id":"app.workspace","since":1,"labelKey":"state.app.workspace.label","descriptionKey":"state.app.workspace.description","category":"app","value":{"type":"enum","enumValues":["projectHub","studio","live","safe"]},"scope":"appLocal","updateClass":"onChange","authority":"uiViewModel","nullable":false,"default":"projectHub","format":"plain","persisted":true,"deprecated":false},{"id":"app.skin.id","since":1,"labelKey":"state.app.skin.id.label","descriptionKey":"state.app.skin.id.description","category":"app","value":{"type":"string","maxLength":128},"scope":"appLocal","updateClass":"onChange","authority":"application","nullable":false,"default":"com.emberlights.skin.safe","format":"plain","persisted":true,"deprecated":false},{"id":"app.skin.status","since":1,"labelKey":"state.app.skin.status.label","descriptionKey":"state.app.skin.status.description","category":"app","value":{"type":"enum","enumValues":["loading","ready","fallback","fault"]},"scope":"appLocal","updateClass":"onChange","authority":"application","nullable":false,"default":"loading","format":"plain","persisted":false,"deprecated":false},{"id":"project.name","since":1,"labelKey":"state.project.name.label","descriptionKey":"state.project.name.description","category":"project","value":{"type":"string","maxLength":512},"scope":"projectDocument","updateClass":"onChange","authority":"projectDocument","nullable":false,"default":"","format":"plain","persisted":true,"deprecated":false},{"id":"project.lifecycle","since":1,"labelKey":"state.project.lifecycle.label","descriptionKey":"state.project.lifecycle.description","category":"project","value":{"type":"enum","enumValues":["none","opening","open","activating","active","fault"]},"scope":"projectDocument","updateClass":"onChange","authority":"application","nullable":false,"default":"none","format":"plain","persisted":false,"deprecated":false},{"id":"project.saveState","since":1,"labelKey":"state.project.saveState.label","descriptionKey":"state.project.saveState.description","category":"project","value":{"type":"enum","enumValues":["saved","unsaved","saving","failed","recovered"]},"scope":"projectDocument","updateClass":"onChange","authority":"projectDocument","nullable":false,"default":"saved","format":"plain","persisted":false,"deprecated":false},{"id":"project.lastVerifiedSave","since":1,"labelKey":"state.project.lastVerifiedSave.label","descriptionKey":"state.project.lastVerifiedSave.description","category":"project","value":{"type":"string","maxLength":64},"scope":"projectDocument","updateClass":"onChange","authority":"projectDocument","nullable":true,"default":null,"format":"timestamp","persisted":false,"deprecated":false},{"id":"project.activeVenue.name","since":1,"labelKey":"state.project.activeVenue.name.label","descriptionKey":"state.project.activeVenue.name.description","category":"project","value":{"type":"string","maxLength":512},"scope":"projectDocument","updateClass":"onChange","authority":"projectDocument","nullable":true,"default":null,"format":"plain","persisted":true,"deprecated":false},{"id":"project.activePackage.available","since":1,"labelKey":"state.project.activePackage.available.label","descriptionKey":"state.project.activePackage.available.description","category":"project","value":{"type":"boolean"},"scope":"activePackage","updateClass":"onChange","authority":"compiler","nullable":false,"default":false,"format":"plain","persisted":false,"deprecated":false},{"id":"project.validation.summary","since":1,"labelKey":"state.project.validation.summary.label","descriptionKey":"state.project.validation.summary.description","category":"project","value":{"type":"object","schemaRef":"validation-summary-v0"},"scope":"projectDocument","updateClass":"onChange","authority":"projectDocument","nullable":false,"default":{},"format":"plain","persisted":false,"deprecated":false},{"id":"runner.state","since":1,"labelKey":"state.runner.state.label","descriptionKey":"state.runner.state.description","category":"runner","value":{"type":"enum","enumValues":["stopped","starting","running","stopping","fault"]},"scope":"runner","updateClass":"onChange","authority":"runnerService","nullable":false,"default":"stopped","format":"plain","persisted":false,"deprecated":false},{"id":"runner.health","since":1,"labelKey":"state.runner.health.label","descriptionKey":"state.runner.health.description","category":"runner","value":{"type":"enum","enumValues":["ok","degraded","fault"]},"scope":"runner","updateClass":"health","maximumPublishHz":4,"authority":"runnerService","nullable":false,"default":"ok","format":"plain","persisted":false,"deprecated":false},{"id":"runner.jitter.p99Ms","since":1,"labelKey":"state.runner.jitter.p99Ms.label","descriptionKey":"state.runner.jitter.p99Ms.description","category":"runner","value":{"type":"number","minimum":0},"scope":"runner","updateClass":"health","maximumPublishHz":4,"authority":"runnerScheduler","snapshotGroup":"runnerTiming","nullable":false,"default":0,"format":"milliseconds","unit":"ms","persisted":false,"deprecated":false},{"id":"connection.dj.status","since":1,"labelKey":"state.connection.dj.status.label","descriptionKey":"state.connection.dj.status.description","category":"connection","value":{"type":"enum","enumValues":["disabled","starting","waiting","connected","stale","hold","fallback","recovering","fault"]},"scope":"connection","updateClass":"health","maximumPublishHz":4,"authority":"adapter","snapshotGroup":"djConnection","nullable":false,"default":"disabled","format":"plain","persisted":false,"deprecated":false},{"id":"connection.os2l.configured","since":1,"labelKey":"state.connection.os2l.configured.label","descriptionKey":"state.connection.os2l.configured.description","category":"connection","value":{"type":"boolean"},"scope":"connection","updateClass":"onChange","authority":"application","nullable":false,"default":false,"format":"plain","persisted":true,"deprecated":false},{"id":"connection.os2l.status","since":1,"labelKey":"state.connection.os2l.status.label","descriptionKey":"state.connection.os2l.status.description","category":"connection","value":{"type":"enum","enumValues":["disabled","starting","waiting","connected","stale","fault"]},"scope":"connection","updateClass":"health","maximumPublishHz":4,"authority":"adapter","snapshotGroup":"os2l","nullable":false,"default":"disabled","format":"plain","persisted":false,"deprecated":false},{"id":"connection.os2l.lastError","since":1,"labelKey":"state.connection.os2l.lastError.label","descriptionKey":"state.connection.os2l.lastError.description","category":"connection","value":{"type":"string","maxLength":4096},"scope":"connection","updateClass":"onChange","authority":"adapter","nullable":true,"default":null,"format":"plain","privacy":"diagnostic","persisted":false,"deprecated":false},{"id":"transport.bpm","since":1,"labelKey":"state.transport.bpm.label","descriptionKey":"state.transport.bpm.description","category":"transport","value":{"type":"number","minimum":0,"maximum":400},"scope":"runner","updateClass":"transport","maximumPublishHz":60,"authority":"runnerScheduler","snapshotGroup":"transport","nullable":false,"default":0,"format":"bpm","unit":"bpm","persisted":false,"deprecated":false},{"id":"transport.syncState","since":1,"labelKey":"state.transport.syncState.label","descriptionKey":"state.transport.syncState.description","category":"transport","value":{"type":"enum","enumValues":["exact","hold","audioFallback","manual","safeUnsynchronized","recovering","fault"]},"scope":"runner","updateClass":"health","maximumPublishHz":20,"authority":"runnerScheduler","snapshotGroup":"transport","nullable":false,"default":"safeUnsynchronized","format":"plain","persisted":false,"deprecated":false},{"id":"controller.status","since":1,"labelKey":"state.controller.status.label","descriptionKey":"state.controller.status.description","category":"controller","value":{"type":"enum","enumValues":["none","starting","ready","partial","fault"]},"scope":"controller","updateClass":"health","maximumPublishHz":4,"authority":"adapter","nullable":false,"default":"none","format":"plain","persisted":false,"deprecated":false},{"id":"output.universe[0].status","since":1,"labelKey":"state.output.universe0.status.label","descriptionKey":"state.output.universe0.status.description","category":"output","value":{"type":"enum","enumValues":["disabled","starting","waiting","ready","reconnecting","fault"]},"scope":"output","updateClass":"health","maximumPublishHz":4,"authority":"adapter","snapshotGroup":"outputs","nullable":false,"default":"disabled","format":"plain","persisted":false,"deprecated":false},{"id":"output.universe[1].status","since":1,"labelKey":"state.output.universe1.status.label","descriptionKey":"state.output.universe1.status.description","category":"output","value":{"type":"enum","enumValues":["disabled","starting","waiting","ready","reconnecting","fault"]},"scope":"output","updateClass":"health","maximumPublishHz":4,"authority":"adapter","snapshotGroup":"outputs","nullable":false,"default":"disabled","format":"plain","persisted":false,"deprecated":false},{"id":"output.blackout","since":1,"labelKey":"state.output.blackout.label","descriptionKey":"state.output.blackout.description","category":"safety","value":{"type":"boolean"},"scope":"safety","updateClass":"onChange","authority":"runnerScheduler","snapshotGroup":"safetyOutput","nullable":false,"default":false,"format":"plain","persisted":false,"deprecated":false},{"id":"output.workLight","since":1,"labelKey":"state.output.workLight.label","descriptionKey":"state.output.workLight.description","category":"safety","value":{"type":"boolean"},"scope":"safety","updateClass":"onChange","authority":"runnerScheduler","snapshotGroup":"safetyOutput","nullable":false,"default":false,"format":"plain","persisted":false,"deprecated":false},{"id":"safety.summary","since":1,"labelKey":"state.sa